{
  "registry_version": "1.0.0",
  "schema_version": "1.0",
  "authority": "Data Governance & Versioning Framework",
  "seed_status": "authoritative_seeded",
  "datasets": [
    {
      "dataset_id":"DS-MOSPI-ASI-001","dataset_name":"Annual Survey of Industries","publisher":"Ministry of Statistics and Programme Implementation (MoSPI)","source_id":"SRC-MOSPI-ASI","coverage":"Registered organised manufacturing; industry-wise and State-wise; accounting years ending within the financial year","frequency":"annual","unit":"source-defined monetary, count and ratio units","definitions":"Covers registered manufacturing factories and provides input, output, value added, employment and asset measures using NIC 2008 and NPCMS classifications.","dimensions":["industry","state","rural_urban","organisation_type"],"methodology":"Annual establishment survey under the Collection of Statistics Act framework, with web-based collection, validation, non-response treatment and published tabulation methodology.","revision_policy":"Published results and tables are retained by reference year; later releases or corrections must be recorded as new vintages.","latest_observation":"2023-24","ingestion_status":"registered_only","validation_status":"metadata_verified","current_version":"ASI-2023-24","access_location":"https://www.mospi.gov.in/themes/product/65--","licence":"Official public data; redistribution subject to applicable MoSPI dissemination terms.","update_schedule":"annual","status":"active","provenance":{"verification_status":"verified","verified_at":"2026-09-07","verification_basis":"MoSPI National Metadata Structure identifies ASI coverage, classifications, annual frequency, access and methodology; 2023-24 summary results confirm published manufacturing aggregates.","verification_reference":"https://nmds.mospi.gov.in/"}
    },
    {
      "dataset_id":"DS-MOSPI-NAS-001","dataset_name":"National Accounts Statistics","publisher":"Ministry of Statistics and Programme Implementation (MoSPI)","source_id":"SRC-MOSPI-NAS","coverage":"National and State accounts, including GDP, GVA and industry-level aggregates; annual and quarterly estimates","frequency":"annual and quarterly","unit":"source-defined current-price and constant-price monetary units and growth rates","definitions":"National accounts framework covering GDP, GVA, GSDP, national income, capital formation and savings by industry and institutional sector.","dimensions":["industry","institutional_sector","price_basis","national_state","period"],"methodology":"MoSPI National Accounts methodology using multiple primary and administrative sources; current series uses base year 2022-23.","revision_policy":"National Accounts estimates are subject to revisions as improved and more comprehensive information becomes available.","latest_observation":"2025-26","ingestion_status":"registered_only","validation_status":"validated_vintage","current_version":"NAS-2026","access_location":"https://www.mospi.gov.in/publication/national-accounts-statistics-2025-26","licence":"Official public data; redistribution subject to applicable MoSPI dissemination terms.","update_schedule":"annual publication with quarterly estimates and releases","status":"active","provenance":{"verification_status":"verified","verified_at":"2026-09-07","verification_basis":"MoSPI announced the National Accounts Statistics - 2026 publication on 31 August 2026. The current 2022-23-base series and manufacturing growth/share values were independently cross-checked against official MoSPI/PIB material.","verification_reference":"https://www.mospi.gov.in/publication/national-accounts-statistics-2025-26"}
    },
    {
      "dataset_id":"DS-MOSPI-IIP-001","dataset_name":"Index of Industrial Production, Manufacturing","publisher":"Ministry of Statistics and Programme Implementation (MoSPI)","source_id":"SRC-MOSPI-IIP","coverage":"All-India industrial production, including Manufacturing sector; current series base 2022-23=100","frequency":"monthly","unit":"index, 2022-23=100","definitions":"Short-term composite indicator measuring changes in production volume of a basket of industrial products; manufacturing is a separately published sectoral index.","dimensions":["sector","item_group","use_based_category","month"],"methodology":"Current IIP series uses NIC 2008, a revised 2022-23 base, sectoral and item weights, and production data from designated source agencies.","revision_policy":"Monthly releases contain quick estimates followed by revisions and final estimates according to the published revision cycle.","latest_observation":"2026-07","ingestion_status":"registered_only","validation_status":"metadata_verified","current_version":"IIP-2022-23","access_location":"https://www.mospi.gov.in/faq","licence":"Official public data; redistribution subject to applicable MoSPI dissemination terms.","update_schedule":"monthly","status":"active","provenance":{"verification_status":"verified","verified_at":"2026-09-07","verification_basis":"MoSPI released the new IIP series with base 2022-23 on 1 June 2026 and identifies manufacturing as a sectoral index; official FAQ documents current base and revision policy.","verification_reference":"https://www.mospi.gov.in/uploads/latestReleases/latest_release_1779857844835_f8e09093-f2ef-4fb3-9890-6149d4162032_FAQ_for_new_IIP_series_with_base_year_2022-23.pdf"}
    },
    {
      "dataset_id":"DS-MOSPI-PLFS-001","dataset_name":"Periodic Labour Force Survey","publisher":"Ministry of Statistics and Programme Implementation (MoSPI)","source_id":"SRC-MOSPI-PLFS","coverage":"India labour force, employment and unemployment; annual, quarterly and monthly outputs subject to survey design and release","frequency":"annual, quarterly and monthly","unit":"source-defined persons, percentages and rates","definitions":"Produces labour force participation rate, worker population ratio, unemployment rate and activity-status measures, including industry-of-work classifications.","dimensions":["sex","age","rural_urban","state","industry","activity_status"],"methodology":"Household sample survey using published PLFS concepts, definitions, sampling and estimation procedures. The 2025 design introduced changes to support high-frequency estimates.","revision_policy":"Published survey estimates are versioned by survey year or release; methodological breaks must be retained and not silently bridged.","latest_observation":"2025","ingestion_status":"registered_only","validation_status":"metadata_verified","current_version":"PLFS-2025","access_location":"https://www.mospi.gov.in/themes/product/69--","licence":"Official public data; redistribution subject to applicable MoSPI dissemination terms.","update_schedule":"monthly, quarterly and annual releases","status":"active","provenance":{"verification_status":"verified","verified_at":"2026-09-07","verification_basis":"MoSPI PLFS releases define LFPR, WPR and UR; official 2025 annual release documents the sampling-design change and retained concepts.","verification_reference":"https://www.mospi.gov.in/uploads/latestReleases/latest_release_1774607827733_3e8964a9-268b-4cc9-ad65-cfc8a9e32f08_Press_note_AR_PLFS_2025_23032025_V2.1_26032026_final.pdf"}
    },
    {
      "dataset_id":"DS-MOF-UNION-BUDGET-001","dataset_name":"Union Budget and Demands for Grants","publisher":"Ministry of Finance, Government of India","source_id":"SRC-MOF-UNION-BUDGET","coverage":"Union fiscal estimates, revised estimates, actuals and programme/department expenditure documents","frequency":"annual","unit":"source-defined INR monetary units","definitions":"Official Union Budget documents, including Annual Financial Statement, Demands for Grants and expenditure statements.","dimensions":["ministry","department","demand","fiscal_year","budget_stage"],"methodology":"Statutory Union Budget accounting and budget-document presentation; individual statements define their own accounting scope.","revision_policy":"Budget estimates, revised estimates and actual expenditure are separate stages and must remain distinct.","latest_observation":"2026-27","ingestion_status":"registered_only","validation_status":"metadata_verified","current_version":"UNION-BUDGET-2026-27","access_location":"https://www.indiabudget.gov.in/","licence":"Official public government documents; source-specific reproduction terms apply.","update_schedule":"annual","status":"active","provenance":{"verification_status":"verified","verified_at":"2026-09-07","verification_basis":"Official India Budget portal provides the 2026-27 Annual Financial Statement, Consolidated Fund statements and budget documents; spreadsheet notes identify PDFs as final where inconsistencies arise.","verification_reference":"https://www.indiabudget.gov.in/"}
    },
    {